{
  "version": 2,
  "width": 40,
  "height": 25,
  "tiles": [
    11,
    11,
    11,
    11,
    11,
    11,
    11,
    11,
    11,
    11,
    11,
    11,
    11,
    11,
    11,
    11,
    11,
    11,
    11,
    11,
    11,
    11,
    11,
    11,
    11,
    11,
    11,
    11,
    11,
    11,
    11,
    11,
    11,
    11,
    11,
    11,
    11,
    11,
    11,
    11,
    11,
    11,
    11,
    11,
    11,
    11,
    11,
    11,
    11,
    11,
    11,
    11,
    11,
    11,
    11,
    11,
    11,
    11,
    11,
    11,
    11,
    11,
    11,
    11,
    11,
    11,
    11,
    11,
    11,
    11,
    11,
    11,
    11,
    11,
    11,
    11,
    11,
    11,
    11,
    11,
    11,
    0,
    11,
    11,
    0,
    11,
    11,
    0,
    11,
    11,
    0,
    11,
    11,
    0,
    11,
    11,
    0,
    11,
    11,
    0,
    11,
    11,
    0,
    11,
    11,
    0,
    11,
    11,
    0,
    11,
    11,
    0,
    11,
    11,
    0,
    11,
    11,
    0,
    11,
    11,
    0,
    11,
    0,
    0,
    11,
    0,
    0,
    11,
    0,
    0,
    11,
    0,
    0,
    11,
    0,
    0,
    11,
    0,
    0,
    11,
    0,
    0,
    11,
    0,
    0,
    11,
    0,
    0,
    11,
    0,
    0,
    11,
    0,
    0,
    11,
    0,
    0,
    11,
    0,
    0,
    11,
    0,
    11,
    0,
    11,
    0,
    11,
    0,
    11,
    0,
    11,
    0,
    11,
    0,
    11,
    0,
    11,
    0,
    11,
    0,
    11,
    0,
    11,
    0,
    11,
    0,
    11,
    0,
    11,
    0,
    11,
    0,
    11,
    0,
    11,
    0,
    11,
    0,
    11,
    0,
    0,
    0,
    0,
    0,
    0,
    0,
    0,
    0,
    0,
    0,
    0,
    0,
    0,
    0,
    0,
    0,
    0,
    0,
    0,
    0,
    0,
    0,
    0,
    0,
    0,
    0,
    0,
    0,
    0,
    0,
    0,
    0,
    0,
    0,
    0,
    0,
    0,
    0,
    0,
    0,
    0,
    0,
    0,
    0,
    0,
    0,
    0,
    0,
    0,
    0,
    0,
    0,
    0,
    0,
    0,
    0,
    0,
    0,
    0,
    0,
    0,
    0,
    0,
    0,
    0,
    0,
    0,
    0,
    0,
    0,
    0,
    0,
    0,
    0,
    0,
    0,
    0,
    0,
    0,
    0,
    0,
    0,
    0,
    0,
    0,
    0,
    0,
    0,
    0,
    0,
    0,
    0,
    0,
    0,
    0,
    0,
    0,
    0,
    0,
    0,
    0,
    0,
    0,
    0,
    0,
    0,
    0,
    0,
    0,
    0,
    0,
    0,
    0,
    0,
    0,
    0,
    0,
    0,
    0,
    0,
    0,
    0,
    0,
    0,
    0,
    0,
    0,
    0,
    0,
    0,
    0,
    0,
    0,
    0,
    0,
    0,
    0,
    0,
    0,
    0,
    0,
    0,
    0,
    0,
    0,
    0,
    0,
    0,
    0,
    0,
    0,
    0,
    0,
    0,
    0,
    0,
    0,
    0,
    0,
    0,
    0,
    7,
    0,
    0,
    0,
    7,
    0,
    0,
    7,
    7,
    7,
    0,
    0,
    7,
    0,
    0,
    0,
    7,
    0,
    0,
    0,
    7,
    7,
    7,
    0,
    0,
    7,
    7,
    7,
    0,
    7,
    7,
    7,
    7,
    0,
    7,
    7,
    7,
    0,
    0,
    0,
    7,
    0,
    0,
    0,
    7,
    0,
    7,
    0,
    0,
    0,
    7,
    0,
    7,
    0,
    0,
    0,
    7,
    0,
    0,
    0,
    7,
    0,
    0,
    7,
    0,
    0,
    7,
    0,
    0,
    7,
    0,
    0,
    0,
    0,
    7,
    0,
    0,
    7,
    0,
    0,
    0,
    7,
    7,
    7,
    0,
    0,
    7,
    0,
    0,
    0,
    7,
    0,
    7,
    0,
    0,
    0,
    7,
    0,
    0,
    0,
    7,
    0,
    0,
    7,
    0,
    0,
    7,
    0,
    0,
    7,
    0,
    0,
    0,
    0,
    7,
    0,
    0,
    7,
    0,
    0,
    0,
    0,
    7,
    0,
    0,
    0,
    7,
    0,
    0,
    0,
    7,
    0,
    7,
    0,
    0,
    0,
    7,
    0,
    0,
    0,
    7,
    0,
    0,
    7,
    0,
    0,
    7,
    0,
    0,
    7,
    7,
    7,
    0,
    0,
    7,
    0,
    0,
    7,
    0,
    0,
    0,
    0,
    7,
    0,
    0,
    0,
    7,
    0,
    0,
    0,
    7,
    0,
    7,
    0,
    0,
    0,
    7,
    0,
    0,
    0,
    7,
    0,
    0,
    7,
    0,
    0,
    7,
    0,
    0,
    7,
    0,
    0,
    0,
    0,
    7,
    0,
    0,
    7,
    0,
    0,
    0,
    0,
    7,
    0,
    0,
    0,
    7,
    0,
    0,
    0,
    7,
    0,
    7,
    0,
    0,
    0,
    7,
    0,
    0,
    0,
    7,
    0,
    0,
    7,
    0,
    0,
    7,
    0,
    0,
    7,
    0,
    0,
    0,
    0,
    7,
    0,
    0,
    7,
    0,
    0,
    0,
    0,
    7,
    0,
    0,
    0,
    0,
    7,
    7,
    7,
    0,
    0,
    0,
    7,
    7,
    7,
    0,
    0,
    0,
    0,
    7,
    7,
    7,
    0,
    0,
    7,
    7,
    7,
    0,
    7,
    7,
    7,
    7,
    0,
    7,
    7,
    7,
    0,
    0,
    0,
    0,
    0,
    0,
    0,
    0,
    0,
    0,
    0,
    0,
    0,
    0,
    0,
    0,
    0,
    0,
    0,
    0,
    0,
    0,
    0,
    0,
    0,
    0,
    0,
    0,
    0,
    0,
    0,
    0,
    0,
    0,
    0,
    0,
    0,
    0,
    0,
    0,
    0,
    0,
    0,
    0,
    0,
    0,
    0,
    0,
    0,
    0,
    0,
    0,
    0,
    0,
    0,
    0,
    0,
    0,
    0,
    0,
    0,
    0,
    0,
    0,
    0,
    0,
    0,
    0,
    0,
    0,
    0,
    0,
    0,
    0,
    0,
    0,
    0,
    0,
    0,
    0,
    0,
    0,
    0,
    0,
    0,
    0,
    0,
    0,
    0,
    0,
    0,
    0,
    0,
    0,
    0,
    0,
    0,
    0,
    0,
    0,
    0,
    0,
    0,
    0,
    0,
    0,
    0,
    0,
    0,
    0,
    0,
    0,
    0,
    0,
    0,
    0,
    0,
    0,
    0,
    0,
    0,
    0,
    0,
    0,
    0,
    0,
    0,
    0,
    0,
    0,
    0,
    0,
    0,
    0,
    0,
    0,
    0,
    0,
    0,
    0,
    0,
    0,
    0,
    0,
    0,
    0,
    0,
    0,
    0,
    0,
    0,
    0,
    0,
    0,
    0,
    0,
    0,
    0,
    0,
    0,
    0,
    0,
    0,
    11,
    0,
    11,
    0,
    11,
    0,
    11,
    0,
    11,
    0,
    11,
    0,
    11,
    0,
    11,
    0,
    11,
    0,
    11,
    0,
    11,
    0,
    11,
    0,
    11,
    0,
    11,
    0,
    11,
    0,
    11,
    0,
    11,
    0,
    11,
    0,
    11,
    0,
    11,
    0,
    0,
    11,
    0,
    0,
    11,
    0,
    0,
    11,
    0,
    0,
    11,
    0,
    0,
    11,
    0,
    0,
    11,
    0,
    0,
    11,
    0,
    0,
    11,
    0,
    0,
    11,
    0,
    0,
    11,
    0,
    0,
    11,
    0,
    0,
    11,
    0,
    0,
    11,
    0,
    11,
    11,
    0,
    11,
    11,
    0,
    11,
    11,
    0,
    11,
    11,
    0,
    11,
    11,
    0,
    11,
    11,
    0,
    11,
    11,
    0,
    11,
    11,
    0,
    11,
    11,
    0,
    11,
    11,
    0,
    11,
    11,
    0,
    11,
    11,
    0,
    11,
    11,
    0,
    11,
    11,
    11,
    11,
    11,
    11,
    11,
    11,
    11,
    11,
    11,
    11,
    11,
    11,
    11,
    11,
    11,
    11,
    11,
    11,
    11,
    11,
    11,
    11,
    11,
    11,
    11,
    11,
    11,
    11,
    11,
    11,
    11,
    11,
    11,
    11,
    11,
    11,
    11,
    11,
    11,
    11,
    11,
    11,
    11,
    11,
    11,
    11,
    11,
    11,
    11,
    11,
    11,
    11,
    11,
    11,
    11,
    11,
    11,
    11,
    11,
    11,
    11,
    11,
    11,
    11,
    11,
    11,
    11,
    11,
    11,
    11,
    11,
    11,
    11,
    11,
    11,
    11,
    11,
    11,
    11
  ],
  "palette": [
    {
      "tileId": 0,
      "fg": 0,
      "bg": 7
    },
    {
      "tileId": 1,
      "fg": 15,
      "bg": 0
    },
    {
      "tileId": 2,
      "fg": 15,
      "bg": 0
    },
    {
      "tileId": 3,
      "fg": 15,
      "bg": 0
    },
    {
      "tileId": 4,
      "fg": 15,
      "bg": 0
    },
    {
      "tileId": 5,
      "fg": 0,
      "bg": 3
    },
    {
      "tileId": 6,
      "fg": 0,
      "bg": 11
    },
    {
      "tileId": 7,
      "fg": 0,
      "bg": 4
    },
    {
      "tileId": 8,
      "fg": 0,
      "bg": 12
    },
    {
      "tileId": 9,
      "fg": 0,
      "bg": 2
    },
    {
      "tileId": 10,
      "fg": 0,
      "bg": 10
    },
    {
      "tileId": 11,
      "fg": 0,
      "bg": 0
    },
    {
      "tileId": 16,
      "fg": 15,
      "bg": 0
    },
    {
      "tileId": 17,
      "fg": 15,
      "bg": 0
    },
    {
      "tileId": 21,
      "fg": 15,
      "bg": 0
    },
    {
      "tileId": 22,
      "fg": 15,
      "bg": 0
    },
    {
      "tileId": 23,
      "fg": 15,
      "bg": 0
    },
    {
      "tileId": 24,
      "fg": 0,
      "bg": 15
    },
    {
      "tileId": 25,
      "fg": 0,
      "bg": 15
    },
    {
      "tileId": 26,
      "fg": 0,
      "bg": 15
    },
    {
      "tileId": 27,
      "fg": 0,
      "bg": 15
    }
  ]
}